show_id,type,title,director,cast,country,date_added,release_year,rating,duration,listed_in,description
s40,Movie,Yoga to Harness Your Chakra Energy,Mark Knight,Caroline Shola Arewa,,,2014,ALL,18 min,"Faith and Spirituality, Special Interest","Sharecare Windows presents Caroline Shola Arewa who describes the positions, meaning and qualities of energy, as well as the seven main chakras, gently leading you into a guided chakra meditation. Chakras are at the heart of the human energy system and understanding the chakra system can positively affect your physical health, emotional stability and spiritual awareness."
s5065,TV Show,The Rebel Princess,,"Zhang Ziyi, Zhou Yiwei",,,2021,TV-14,1 Season,"Drama, Romance","The play tells the story of the princess Wang Xuan (played by Zhang Ziyi) She became her father's chess piece and married Lord Yuzhang, Xiao Qi (played by Zhou Yiwei), from a humble background. The couple fell in love with each other because of a blessing in disguise. In the end, the couple joined hands to create a new era and guard their homeland's people."
s1072,TV Show,Secret Diary of a Call Girl,,"Billie Piper, Iddo Goldberg, Cherie Lunghi, Lily James, Ashley Madekwe, Joanna Bobin, James D'Arcy, David Dawson",,,2011,18+,3 Seasons,"Drama, Romance","The real-life anonymous blog and book of a high-class London call girl known to the world only as ""Belle de Jour"" becomes this original series starring Billie Piper as Hannah, an ambitious young woman leading an exciting but dangerous double life as an expensive escort named ""Belle"" that not even her best friend suspects. Cherie Lunghi and Iddo Goldberg costar in this hit British series."
s5826,TV Show,Bubble Bip,,"Marc Gómez, Christina Jopling, Cydney Fam, Michael Mena, Paula Barros",,,2015,7+,2 Seasons,"Animation, Kids","Bip is a bubble slinging, video game hero who spends his days defeating sassy squids from one level to the next. Entering Earth for the first time, Bip befriends a group of whacky kids and engages in endless adventures!"
s7133,Movie,Resentment,Natalia Shaufert,"Dana Ciobanu, Mircea Marco, Iurie Radu, Ana Tkacenko, Anatol Durbalã",,,2019,16+,95 min,"Action, Drama","At the age of 30, Galina is looking for love, but meets a good soldier only for war."
s2955,Movie,Brothers O'Toole,Richard Erdman,"John Astin, Pat Carroll, Hans Conried, Richard Erdman, Allyn Joslyn, Richard Jury, Lee Meriwether, Jesse White, Steve Carlson, Miranda Barry, Francelle Fuller, Ted Claassen, Harlan Knudson, Leon Inge, Jacques Hampton, Charlie Dell, Vern Porter, Noomis Jones, Leland Murray, Ed Mullancy, William Oakley, Gary Tessler, The Rufus Krisp Ensemble",,,1973,,95 min,"Comedy, Western","Western spoof about two con-artist characters at large in 1890 Colorado. The comedy is centered around a gold hunt with lots of fun. Hans Conreid is excellent as the bedraggled, bombastic politician."
s1035,Movie,Sharknado 4: The 4th Awakens,Anthony C. Ferrante,"Ian Ziering, Tara Reid, David Hasselhoff, Gary Busey, Tommy Davidson, Cody Linley, Imani Hakim",United States,,2016,13+,85 min,"Action, Horror, Science Fiction","Five years after the wave of sharknados that wracked the east coast, our heroes are living a quiet life in the middle of the country – as far away from sharks as possible. But when a freak sand sharknado hits Vegas, Fin is thrown back into action, fighting sharknados on a cross-country race to save his family and the world – as all mankind should know by now, there is no escaping..."
s4114,Movie,The Dark Valley,Andreas Prochaska,"Sam Riley, Tobias Moretti, Helmuth Hausler, Paula Beer, Clemens Schick",,,2014,13+,115 min,"Suspense, Western","A mysterious stranger arrives in a snow capped Austrian mountain village claiming to be a travelling photographer from America, yet is in fact an embittered gunfighter on a mission of vengeance."
s4722,Movie,Night of a Lone Owl,Galina Salgarelli,"Olga Pogodina, Andrey Chernyishov, Tatyana Kravchenko, Andrey Gradov, Anna Antonova, Ivan Kozhevnikov, Pavel Remezov, Mikhail Khimichev, Elena Dubrovskaya, Zakhar Ronzhin",,,2011,13+,90 min,"Comedy, Drama, Fantasy","Once before the New Year, the restaurant owner Vadim unexpectedly comes with inspection. Being in a bad temper, he dismisses Anya, the chef, who a soul of the entire restaurant. As a result, the New Year's corporate event planned for this evening turns into a farewell to the favourite chef. But the biggest surprise waiting for them at midnight in the cottage which they'll arrive to for the party."
s7151,Movie,Stealing Chaplin,Paul Tanter,"Charles Chaplin, Al Sapienza, Wayne Newton, Peter Woodward, Simon Phillips, Anne-Carolyne Binette, Cheryl Prater",,,2021,18+,106 min,"Action, Comedy","Inspired by real events, the story centers around two Las Vegas-based con men who dig up and steal the corpse of comedian Charlie Chaplin in order to ransom it. With the theft gaining the world's attention and the reward rising daily, soon every local lowlife, criminal and dirty cop wants a piece of the action."
s7795,Movie,Nee Naan Nizhal,John Robinson,"Ishitha Chauhan, Arjun Lal, R. Sarathkumar, Devan, Manoj K. Jayan, M. S. Bhaskar",,,2014,13+,120 min,Drama,"Five people get murdered in Malaysia and the cop who investigates the crime finds out that they have a common Facebook friend - Asha Black. Meanwhile, a young man from India comes to the country to meet Asha, after she befriends him on Facebook!"
s8745,Movie,From The Files of Joseph Wambaugh: A Jury of One,Alan Metzger,"John Spencer, Eddie Velez, Rachel Ticotin",,,1992,16+,93 min,Drama,"An action-drama about an LAPD Homicide Detective and his struggles with gang related crime on the streets, the difficulties of working within the legal system and his own personal conflict about the accidental shooting death of a fellow officer."
s5313,Movie,True Grit,Henry Hathaway,"John Wayne, Glen Campbell, Kim Darby, Jeremy Slate, Robert Duvall, Dennis Hopper, Strother Martin, John Fiedler",,,1969,G,128 min,"Action, Drama, Western","A drunken, hard-nosed U.S. Marshal and a Texas Ranger help a stubborn young woman track down her father's murderer in Indian territory."
s7818,Movie,Defendor,Peter Stebbings,"Woody Harrelson, Elias Koteas, Michael Kelly, Sandra Oh, Kat Dennings",,,2010,R,101 min,"Comedy, Drama, Science Fiction","Despite lacking any actual superpowers, Arthur Poppington transforms himself into the costumed vigilante Defendor. But danger beckons when our hero tries to protect a young prostitute from an assailant who turns out to be a corrupt undercover cop."
s2345,TV Show,Girl/Girl Scene,,"Tucky Williams, Kayden Kross, Lauren Virginia Abert, Katie Stewart, Roni Jonah, Cyndy Allen, Joe Gatton",,,2017,18+,2 Seasons,"Comedy, Drama, LGBTQ","Girl/Girl Scene is the sexy, award-winning lesbian drama series that shocked the world with its provocative vision of life as a modern gay girl. Follow bad-girl Evan, escort Avery, Southern belle Maxine, stoner Bender and teenage runaway Ling as they navigate their passionate and intertwining love lives."
s8590,Movie,When I'm 64,Jon Jones,"Alun Armstrong, Paul Freeman, Tamsin Greig",,,2004,16+,88 min,"Drama, LGBTQ, Romance","When widowed cabbie Ray and retired teacher Jim meet by chance, they discover they long for the same things from life: adventure, challenge and love. Together Ray and Jim discover that being 64 means a new beginning: it's time to try the things they never dared in their youth."
s4272,Movie,The Evening Star,Robert Harling,"Juliette Lewis, Shirley MacLaine, Jack Nicholson, Bill Paxton",,,1996,PG-13,129 min,"Comedy, Drama","Still missing her daughter 13 years after her death in ""Terms of Endearment,"" Aurora Greenway (Shirley MacLaine) struggles to keep her family together. She has one grandson in jail, a rebellious granddaughter, and another grandson living just above the poverty line."
s9090,Movie,Swimming for Gold,Hayley MacFarlane,"Peyton List, Daniel Needs",,,2020,UNRATED,91 min,"Comedy, Kids",A US women’s swim team Olympic hopeful suffers an injury that forces her to put aside her dreams and help the Australian men’s swim team get competition ready.
s1157,TV Show,Rick Steves' Europe,,Rick Steves,,,2018,TV-G,4 Seasons,"Documentary, Special Interest","Rick Steves' Europe is public television's most-watched, longest-running travel series. Written and hosted by best-selling guidebook author Rick Steves, each half-hour show takes viewers to Europe's most interesting places, from great cities to off-the-beaten-path discoveries."
s4865,Movie,The woman I lost,Roberto Rodríguez,"Pedro Infante, Blanca Estela Pavón, Manuel R. Ojeda, Eduardo Arozamena, Silvia Pinal, José Luis Jiménez",,,1949,16+,90 min,Drama,"In defense of his girlfriend Pedro kills the attorney's son. Because of this, helped by the Indians, he has to escape from the father of the deceased. In the persecution Pedro is wounded but healed by Maria, who also helps him escape from the feds."
s2232,Movie,Heidi,Alain Gsponer,"Anuk Steffen, Bruno Ganz, Anna Schinz",,,2017,7+,111 min,"Adventure, Drama, Kids","Based on the biggest Swiss bestseller of all time (written by Johanna Spyri), young orphan girl Heidi lives in the Swiss Alps with her goat herding grandfather. Forced to move into the home of an upper-class Frankfurt family, the energetic child struggles to fit in, longing for the simplicity of her life in the mountains."
s7723,Movie,Mia meets Morgenrot,Martin Pfeil,"Ana Dordevic, Guido Drell, Tom von der Isar, Frederik Lenke, Gordana Heyden, Giulio Avise Caselli",,,2020,16+,102 min,"Arthouse, Drama","Mia, a young, attractive woman and mother starts to question the meaning of life due to external circumstances. She tries to escape into the virtual world of chats, where she meets „Morgenrot"" for the first time. It is the beginning of a journey through the unknown, where feelings don't emerge through physical contact, but through words. However, Mia's husband discovers her secret."
s7986,Movie,Thy Neighbor,George A. Johnson,"Dave Payton, Jessica Koloian, Nathan Clarkson",,,2018,16+,94 min,"Drama, Suspense","A hotshot young author becomes the pastor of a small town church with big dreams of changing the world, but things change when he grows suspicious that his neighbor may be a threat to his family's safety."
s568,Movie,The Legend Of Ben Hall,Matthew Holmes,,,,2017,,140 min,"Action, Western","After two years on the run, bushranger Ben Hall considers surrendering to the law when his old friend John Gilbert entices him back into the game. Taking on fresh recruit John Dunn, the gang rides again, and before long they become the most wanted men in the country. When they are declared outlaws, the three decide to flee forever."
s4439,TV Show,Memories of Nanette,,,,,2016,7+,1 Season,"Animation, Kids","When 9-year-old Nanette arrives in the countryside for the first time to live with her Grandpa Archie, Granny Minnie and Aunt Susan, she discovers an environment very different from the city. But with a personality like hers and the help of her new friends Jack, Betty and Johnny, she will enjoy the countryside as an immense playground, in which every inch is to be explored."
s5193,TV Show,Arpo: The Robot for All Kids,,,,,2018,ALL,3 Seasons,"Animation, Kids","Arpo was designed as a commando robot, built as a fierce fighting machine. But, with world peace achieved Arpo has been re-equipped for caregiving, re-coded for cuddling, and officially reassigned as a nanny robot!"
s8616,TV Show,Tugged,,"Liam Gist, Zakiya Mathews, Ashley Mathaw, Chelley Chelle",,,2021,18+,1 Season,"Drama, Romance","Bree takes her first breath as a free woman as she is released from serving her sentence for credit card fraud after the 2020 Pandemic in Los Angeles. She took charges for her Boyfriend Shaun, who was late to pick her up. Once a Bonnie & Clyde kind of love, now, they fight and fuss at each other after losing everything, both of them are holding on to grudges and pain."
s8938,Movie,3 Pints and a Rabbi,Richard J. Perry,"Amanda Abbington, Michael Maloney, Jordan Stephens, Hannaj Bang Bendz",,,2021,18+,73 min,"Comedy, Science Fiction","When three dazed and confused strangers wake up in a pub to a dead woman lying on the table with three hefty chunks of flesh missing, they must figure out what happened to her in order to ensure they don't meet the same fate."
s3026,Movie,Blood On The Sun,Frank Lloyd,Peng Tien,,,1974,R,94 min,"Action, Drama","Based on a true story, James Cagney stars as an American reporter in pre-war Japan in this riveting, brutal, action-packed film tracing the unintended unveiling of the dreaded Tanaka Plan for Japanese world domination. Cagney, given a purloined copy of the plan, is pursued by a beautiful Japanese secret agent (Sylvia Sidney) sent to romance and ensnare him before he can get it to the American Embassy and into the world press."
s9377,Movie,Nootokka Jillala Andagadu,Rachakonda Vidyasagar,"Avasarala Srinivas, Ruhani Sharma",,,2021,ALL,119 min,"Comedy, Drama","Gotti Satyanarayana or GSN, a man with premature baldness is unmarried and works at a real estate company. There he meets the beautiful Anjali, and the sparks fly between the two. GSN keeps his baldness hidden from Anjali and the people around him. What happens once his secret gets out? Will Anjali still be with him? Forms the rest of the story."
s5647,Movie,The Lie,Veena Sud,"Joey King, Peter Sarsgaard, Mireille Enos",United States,,2020,16+,95 min,"Drama, Horror, Suspense","When their teenaged daughter confesses to impulsively killing her best friend, two desperate parents cover up the horrific crime with a web of lies and deception."
s7424,Movie,Answers to Nothing,Matthew Leutwyler,"Miranda Bailey, Julie Benz, Dane Cook, Zach Gilford, Kali Hawk, Mark Kelly, Elizabeth Mitchell, Erik Palladino, Vincent Ventresca, Aja Volkman, Barbara Hershey",,,2011,R,124 min,"Drama, Suspense","Starring Dane Cook, Answers to Nothing tells the interweaving stories of several Los Angelenos trying to do the right thing against the backdrop of a missing girl case."
s7204,Movie,Indelible,Ryuichi Tsunoda,,,,2020,13+,74 min,Documentary,"A story of reunion between a father and a son who had lost touch for 18 years. A Chinese Korean boy emigrated to Japan when he was 10 years old, and when he turned 20, he looked for his father, a painter. However, his father was working as a day laborer in Korea and struggling with debts. Out of vanity, he tries to express his love for his child with money..."
s5022,Movie,Journey's End,Saul Dibb,"Sam Claflin, Asa Butterfield, Paul Bettany, Toby Jones, Tom Sturridge, Stephen Graham",,,2018,R,107 min,"Drama, Military and War","The Great War - March, 1918. C-company arrives to take its turn in the front-line trenches of northern France, led by war-weary Captain Stanhope. With a German offensive imminently approaching, the company anxiously awaits their unknown fate."
s8900,Movie,Ong Bak - The Thai Warrior,Prachya Pinkaew,"Tony Jaa, Petchtai Wongkamlao",,,2005,R,105 min,"Action, Adventure, Horror","Tony Jaa, the fighting superstar ""destined for film's martial arts pantheon,"" (New York Daily News) electrifies as a religious young warrior who swears an oath of peace. But when a gangster steals the head of Ong-Bak, his village's deity, Ting heads for Bangkok to get it back. In a film Time Magazine calls ""exhilarating"" with relentless, fever-pitched action free of stunt ..."
